{
  "$schema": "http://json-schema.org/draft-07/schema#",
  "type": "object",
  "description": "Project metadata schema definition",
  "properties": {
    "target_host": {
      "type": "string",
      "description": "The address of any server required by the task, formatted as hostname:\\d{4} for port number."
    },
    "runtime": {
      "type": "object",
      "description": "Optional explicit runtime intent for local tooling. When omitted, runtime is inferred from target_host.",
      "properties": {
        "kind": {
          "type": "string",
          "enum": [
            "local",
            "server"
          ],
          "description": "Whether the runner should treat this as a local-code task or a live-server task."
        }
      },
      "additionalProperties": false
    },
    "install_command": {
      "type": "string",
      "description": "Optional build/install command used by local-code workflows."
    },
    "info": {
      "type": "string",
      "description": "Optional task notes passed to the agent, such as credentials or setup hints."
    },
    "invariant_thresholds": {
      "type": "object",
      "description": "The thresholds for invariant checks, where the key is the name of the check and the value is the threshold.",
      "patternProperties": {
        "^[a-zA-Z0-9_\\-]+$": {
          "type": "number",
          "description": "The threshold for the invariant check with the given name."
        }
      },
      "additionalProperties": false
    },
    "invariant_test_paths": {
      "type": "array",
      "description": "A list of unit test paths (directories and/or files) used in repo level check invariants.",
      "items": {
        "type": "string"
      }
    }
  },
  "required": [
    "target_host",
    "invariant_thresholds",
    "invariant_test_paths"
  ]
}
